tid,name,symbol,rating_level,rating_score,underlying_technology_security,token_performance,ecosystem_development,team_partners_investors,token_economics,roadmap_progress,tags
origintrail,OriginTrail,TRAC,B,50.53,76.70%,38.67%,33.35%,47.33%,51.80%,52.33%,"Data, Infrastructure"
ankreth,Ankr Staked ETH,ANKRETH,B,50.37,66.65%,31.07%,41.25%,63.00%,43.20%,54.67%,"Ethereum, Staking, DeFi, Liquid Staking Derivatives (LSD)"
venus,Venus,XVS,B,50.37,46.70%,44.73%,41.85%,38.67%,92.00%,42.33%,"BNB Chain, Lending, DeFi, Governance"
my-neighbor-alice,My Neighbor Alice,ALICE,B,50.23,51.50%,58.53%,37.10%,52.67%,42.20%,63.33%,"NFT, Game, Ethereum, BNB Chain, Metaverse"
polymesh,Polymesh,POLYX,B,50.19,67.45%,48.73%,35.10%,61.67%,33.80%,53.67%,Public Chain
agoric,Agoric,BLD,B,50.07,58.25%,29.20%,21.85%,74.87%,37.93%,85.00%,"DeFi, Public Chain, Cosmos"
just,JUST,JST,B,50.06,54.75%,46.87%,42.65%,46.33%,62.33%,48.33%,"Tron, DeFi, Lending, Governance, Stablecoins"
ravencoinrvn1,Ravencoin,RVN,B,50.02,62.25%,47.73%,24.55%,54.00%,69.33%,46.67%,"Mining, Public Chain, Privacy, PoW"
rsk-infrastructure-framework,RSK Infrastructure Framework,RIF,B,50.02,47.45%,42.07%,22.95%,76.53%,63.33%,57.67%,"Infrastructure, Payment, Public Chain"
camelot-token,Camelot Token,GRAIL,B,50.02,49.70%,38.73%,48.25%,52.00%,52.47%,59.67%,"Arbitrum, DEX, DeFi, AMM"
stargaze,Stargaze,STARS,B,49.99,56.55%,32.07%,41.70%,42.00%,61.53%,66.67%,"Cosmos, NFT, Marketplace, Layer 1"
ecomi,ECOMI,OMI,B,49.84,49.50%,33.73%,32.60%,72.00%,49.07%,68.00%,"NFT, PFP, Ethereum"
nym,NYM,NYM,B,49.82,51.80%,43.87%,30.30%,80.33%,45.13%,53.33%,"Public Chain, Data, Privacy, Ethereum"
akash-networkakt,Akash Network,AKT,B,49.71,48.05%,44.40%,51.20%,53.67%,35.00%,66.00%,"Storage, Cosmos, Public Chain, Cloud Computing, Infrastructure"
radio-caca,Radio Caca,RACA,B,49.7,55.40%,46.40%,38.05%,26.67%,63.33%,70.33%,"NFT, Game, BNB Chain, Metaverse, Marketplace"
space-id,SPACE ID,ID,B,49.65,60.25%,52.27%,36.55%,42.00%,42.33%,65.33%,"BNB Chain, Arbitrum, Web3"
highstreet,Highstreet,HIGH,B,49.49,65.30%,43.13%,25.60%,61.33%,44.93%,59.33%,"Game, Metaverse, Ethereum, BNB Chain, AI"
okexchain,OKC,OKT,B,49.34,41.45%,30.67%,40.75%,66.33%,64.67%,57.67%,"Public Chain, OKX"
iexec,iExec,RLC,B,49.21,66.55%,43.13%,36.05%,48.67%,44.80%,54.67%,"Cloud Computing, Marketplace"
everipedia,IQ.wiki,IQ,B,49.17,63.30%,56.13%,28.65%,51.33%,40.07%,57.67%,"Ethereum, EOS, Polygon, DeFi, Social"
olympus,Olympus,OHM,B,49.12,72.30%,37.07%,39.85%,26.00%,64.33%,50.53%,"DeFi, Ethereum, DAO, Governance"
mobox,MOBOX,MBOX,B,49.02,53.35%,39.73%,50.70%,51.33%,35.00%,62.00%,"BNB Chain, Game, NFT, DeFi, Infrastructure"
holo,Holo,HOT,B,48.98,74.10%,50.87%,22.50%,23.33%,54.53%,69.00%,"Public Chain, Storage, Ethereum, Data"
polymath,Polymath,POLY,B,48.92,70.25%,38.53%,33.60%,68.67%,42.80%,37.67%,"Marketplace, Fund Raising, Ethereum"
apenft,APENFT,NFT,B,48.9,59.15%,46.33%,51.35%,16.67%,63.33%,52.33%,"NFT, Tron, Marketplace"
stepn,STEPN,GMT,B,48.79,51.90%,54.27%,45.45%,36.33%,47.20%,57.67%,"Solana, BNB Chain, Game, Sports, Web3"
gearbox,Gearbox Protocol,GEAR,B,48.36,73.50%,35.60%,40.30%,31.33%,35.07%,68.67%,"Ethereum, DeFi, Derivatives, Governance"
steem,Steem,STEEM,B,48.32,64.20%,40.73%,26.85%,52.00%,66.67%,41.33%,"Social, Public Chain"
siacoin,Siacoin,SC,B,48.26,62.00%,57.00%,18.80%,43.67%,62.33%,51.00%,"PoW, Mining, Public Chain"
deri-protocol,Deri Protocol,DERI,B,48.23,69.00%,42.33%,38.70%,43.53%,36.07%,56.00%,"Derivatives, DEX, AMM"
kujira,Kujira,KUJI,B,47.98,53.20%,29.20%,41.80%,32.00%,60.33%,71.67%,"Layer 1, Cosmos, PoS"
alpha-finance,Stella (previously Alpha Venture DAO),ALPHA,B,47.98,61.10%,53.07%,32.45%,61.67%,37.07%,43.33%,"Lending, Launchpad, Ethereum, DeFi"
firmachain,FirmaChain,FCT,B,47.95,62.05%,34.00%,35.35%,44.33%,38.47%,73.00%,"Data, Cosmos, Ethereum"
x2y2,X2Y2,X2Y2,B,47.74,40.20%,36.67%,36.45%,40.33%,72.40%,66.67%,"NFT, Marketplace, Ethereum, NFT MarketPlace"
hooked-protocol,Hooked Protocol,HOOK,B,47.63,29.95%,44.00%,30.50%,60.07%,64.67%,68.20%,"Game, Social, BNB Chain"
lisk,Lisk,LSK,CCC,47.58,66.85%,46.00%,24.40%,50.20%,43.33%,56.00%,"Public Chain, Layer 1, Web3, Wallet"
safemoon-v2,SafeMoon V2,SFM,CCC,47.57,45.00%,33.87%,44.70%,38.33%,60.00%,65.33%,"DeFi, NFT, BNB Chain, Wallet"
dusk-network,Dusk,DUSK,CCC,47.52,62.20%,56.40%,32.30%,51.33%,45.07%,38.00%,"Privacy, Public Chain, BNB Chain, Ethereum"
function-x,Function X,FX,CCC,47.5,38.60%,38.33%,34.50%,62.67%,49.87%,68.33%,"Ethereum, Public Chain, Exchanges, Wallet, DeFi"
flamingo,Flamingo,FLM,CCC,47.29,59.25%,49.33%,24.70%,37.33%,49.33%,67.33%,"Neo, DeFi, Governance"
constellation-network,Constellation Network,DAG,CCC,47.26,52.50%,33.87%,30.15%,65.00%,33.67%,72.33%,"Public Chain, DeFi, Payment"
sudoswap,Sudoswap,SUDO,CCC,47.24,58.40%,26.93%,38.25%,52.00%,48.80%,58.33%,"Ethereum, DeFi, NFT, AMM, DEX, NFT MarketPlace"
bitcoin-svbsv,Bitcoin SV,BSV,CCC,47.15,62.50%,57.47%,20.90%,47.00%,60.67%,38.00%,"Fork, PoW, Bitcoin, Public Chain"
numeraire,Numerai,NMR,CCC,47.08,70.20%,47.20%,21.80%,66.33%,52.67%,25.00%,"Data, Ethereum, Fund, AI"
stakewise,StakeWise,SWISE,CCC,47.03,74.45%,33.67%,30.60%,48.00%,34.13%,57.67%,"Ethereum, Staking, Liquid Staking Derivatives (LSD)"
alethea-artificial-liquid-intelligence-token,Alethea AI,ALI,CCC,47.01,58.15%,39.13%,35.50%,55.67%,46.40%,47.33%,"NFT, Ethereum, Metaverse, Cronos, AI"
vela-token,Vela Token,VELA,CCC,46.99,46.75%,38.20%,28.80%,37.67%,65.67%,71.00%,"Arbitrum, DEX, DeFi, Derivatives"
ethereum-pow-fork-iou,Ethereum (Proof of Work),ETHW,CCC,46.95,44.15%,47.73%,29.05%,50.67%,61.33%,55.67%,"PoW, Layer 1"
wemix-token,WEMIX,WEMIX,CCC,46.86,31.20%,39.40%,32.30%,61.53%,65.47%,61.33%,"Game, Infrastructure, NFT, Wallet, Public Chain"
seth2,sETH2,SETH2,CCC,46.81,74.45%,26.93%,29.60%,48.00%,40.73%,57.67%,"Ethereum, DeFi, Staking"
bifrost2,Bifrost ,BFC,CCC,46.68,49.55%,37.00%,29.55%,51.33%,60.07%,57.33%,"DeFi, Staking, Polkadot, Liquid Staking Derivatives (LSD)"
tokamak-network,Tokamak Network,TON,CCC,46.66,63.75%,29.67%,20.45%,62.00%,43.80%,63.33%,"Layer 2, Ethereum, Infrastructure"
convex-crv,Convex CRV,cvxCRV,CCC,46.63,73.65%,24.73%,46.75%,21.33%,40.60%,63.67%,"Ethereum, DeFi, Curve, Staking, Liquid Staking Token"
superrare,SuperRare,RARE,CCC,46.61,63.25%,40.40%,33.95%,64.00%,39.40%,37.33%,"NFT, Marketplace, Ethereum, DAO, NFT MarketPlace"
lukso,LUKSO,LYXE,CCC,46.56,44.60%,34.07%,26.15%,71.00%,73.33%,37.67%,Public Chain
orbs-network,Orbs Network,ORBS,CCC,46.42,54.85%,51.93%,39.35%,46.00%,46.60%,39.33%,"Public Chain, Infrastructure"
qidao,QiDao,QI,CCC,46.39,47.80%,30.87%,34.80%,30.33%,86.27%,51.67%,"Polygon, DeFi, Lending, Governance"
smooth-love-potion,Smooth Love Potion,SLP,CCC,46.36,57.95%,59.07%,14.05%,48.67%,50.33%,55.00%,"Ethereum, Game, NFT"
efinity,Efinity,EFI,CCC,46.32,38.75%,34.20%,44.10%,66.00%,52.13%,46.00%,"Polkadot, NFT, Ethereum, Marketplace, Cross-Chain"
mango-markets,Mango Markets,MNGO,CCC,46.18,55.15%,35.07%,40.70%,32.00%,69.00%,44.00%,"Solana, DEX, Derivatives, DeFi"
tether-gold,Tether Gold,XAUT,CCC,46.08,46.60%,31.93%,40.85%,64.33%,36.00%,58.33%,"Stablecoins, Tether"
juno,Juno,JUNO,CCC,45.99,38.70%,34.73%,50.20%,36.33%,69.33%,47.67%,"Cosmos, Layer 1, PoS"
access-protocol,Access Protocol,ACS,CCC,45.79,45.15%,36.13%,42.30%,50.33%,45.20%,57.00%,"Web3, Traditional Industry, Solana"
amo-coin,AMO,AMO,CCC,45.73,54.95%,32.00%,15.25%,62.00%,43.93%,73.33%,"Public Chain, Data, Traditional Industry"
carry,Carry,CRE,CCC,45.72,56.95%,28.60%,24.10%,71.33%,44.80%,52.00%,"Traditional Industry, Ethereum"
euler,Euler,EUL,CCC,45.52,53.35%,35.47%,40.05%,44.00%,39.47%,60.00%,"Ethereum, Lending, DeFi, Governance"
apollox,ApolloX,APX,CCC,45.49,25.90%,27.07%,23.25%,43.00%,95.00%,72.67%,"Exchanges, DEX, Derivatives, BNB Chain, Governance"
binance-usd,Binance USD,BUSD,CCC,45.4,42.55%,47.00%,14.70%,72.00%,40.67%,66.67%,"Stablecoins, BNB Chain, Binance"
berry,Berry,BERRY,CCC,45.33,56.40%,42.00%,35.45%,41.87%,30.33%,65.53%,"Traditional Industry, Social, Web3"
everscale,Everscale,EVER,CCC,45.24,56.30%,43.47%,32.30%,42.33%,43.33%,54.33%,Public Chain
omg-network,OMG Network,OMG,CCC,45.21,50.35%,63.00%,9.35%,72.67%,56.80%,29.33%,"Layer 2, Payment, Staking, Ethereum, Public Chain, Governance"
moonbeam,Moonbeam,GLMR,CCC,45.19,55.05%,48.53%,30.25%,46.00%,36.67%,56.33%,"Polkadot, Public Chain, Moonbeam"
amp,Amp,AMP,CCC,45.18,48.60%,45.80%,31.20%,68.00%,44.33%,36.67%,"Payment, Ethereum"
